{
  "name": "Wizard",
  "srd_id": "class:wizard:srd-5-1",
  "edition": "5e-2014",
  "license": "CC-BY-4.0",
  "source": {
    "title": "System Reference Document 5.1",
    "url": "https://dnd.wizards.com/resources/systems-reference-document",
    "publisher": "Wizards of the Coast"
  },

  "hit_die": 6,
  "primary_abilities": ["INT"],
  "saving_throw_proficiencies": ["INT", "WIS"],

  "proficiencies": {
    "armor": [],
    "weapons": ["Daggers", "Darts", "Slings", "Quarterstaffs", "Light crossbows"],
    "tools": [],
    "skills": {
      "choose": 2,
      "from": ["(as per SRD)"]
    }
  },

  "spellcasting": {
    "is_spellcaster": true,
    "spellcasting_ability": "INT",
    "progression_note": null,
    "slots_by_level": null,
    "cantrips_known_by_level": null
  },

  "features_by_level": [
    {
      "level": 1,
      "features": [
        {
          "name": "Spellcasting",
          "srd_feature_id": "wizard:spellcasting",
          "description_md": "SRD placeholder — prepare & cast wizard spells; no full text here.",
          "source": "SRD 5.1"
        },
        {
          "name": "Arcane Recovery",
          "srd_feature_id": "wizard:arcane-recovery",
          "description_md": "SRD placeholder — recover some spell slots on a short rest.",
          "source": "SRD 5.1"
        }
      ]
    },
    {
      "level": 2,
      "features": [
        {
          "name": "Arcane Tradition",
          "srd_feature_id": "wizard:arcane-tradition",
          "description_md": "SRD placeholder — pick a subclass; details not included.",
          "source": "SRD 5.1"
        }
      ]
    },
    {
      "level": 4,
      "features": [
        {
          "name": "Ability Score Improvement",
          "srd_feature_id": "wizard:asi-1",
          "description_md": "SRD placeholder — increase ability scores or take a feat.",
          "source": "SRD 5.1"
        }
      ]
    }
  ],

  "notes": "Canonical conversion of your Wizard stub (SRD-only placeholders; no full text)."
}
